org_name,org_alt_name,ein_num,org_highlight,city,state,assets,income,mission_statement,facebook_link,twitter_link,youtube_link,instagram_link,linkedin_link
Iowa Heart Foundation,Iowa Heart Center Foundation,42-1372472,"[' cardiovascular healthcare, <em>heart disease</em> prevention, Health, Public health, <em>Diseases</em> and conditions, <em>Heart</em> and circulatory system <em>diseases,</em> Age groups, Children and youth, Adults, Health, People with <em>diseases</em> and illnesses, Non-governmental organizations, Public charities', 'Iowa <em>Heart</em> Foundation is committed to improving <em>heart</em> health education and dedicated to the prevention of <em>heart disease.</em> cardiovascular']",West Des Moines,IA,7315267,682390,Iowa Heart Foundation is committed to improving heart health education and dedicated to the prevention of heart disease.,https://facebook.com/iowaheartfoundation,https://twitter.com/iaheartfdn,,https://instagram.com/iowaheartcenterfoundation/,https://linkedin.com/company/company/iowa-heart-foundation
MERRY HEART CHILDREN'S CAMP,,90-0982755,"[' <em>heart</em> camp, summer camp, congenital <em>heart disease,</em> Sports and recreation, Community recreation, Camps, Age groups, Children and youth, Non-governmental organizations', ""The mission of Merry <em>Heart</em> Children's Camp is to provide a safe, nurturing, and fun outdoor experience for youth with <em>heart</em> conditions where they can meet new friends and develop courage and independence without fear of being judged by others. heart""]",Portland,OR,317926,136227,"The mission of Merry Heart Children's Camp is to provide a safe, nurturing, and fun outdoor experience for youth with heart conditions where they can meet new friends and develop courage and independence without fear of being judged by others.",https://facebook.com/MerryHeartCC,https://twitter.com/MerryHeartCC,,https://instagram.com/merryheartcc,
CAMP ODAYIN,,41-2014358,"[' children, health, camp, <em>heart disease,</em> families, Health, <em>Diseases</em> and conditions, <em>Heart</em> and circulatory system <em>diseases,</em> Sports and recreation, Community recreation, Camps, Human services, Youth development, Youth services, Youth mentoring, Adult', 'Camp Odayin provides fun, safe and supportive camp experiences and community building opportunities for young people with <em>heart disease</em> and their families. children']",St Paul,MN,1558568,1154310,"Camp Odayin provides fun, safe and supportive camp experiences and community building opportunities for young people with heart disease and their families.",https://facebook.com/campodayin,https://twitter.com/campodayin,https://youtube.com/campodayin,https://instagram.com/campodayin,https://linkedin.com/company/4756444
Heart N Hands,,47-1863855,"['awareness of <em>heart</em> health, <em>heart disease</em> prevention, provide <em>heart</em> health education, and encourage healthy lifestyle choices for young girls ages 10-18 and their families.We promote physical activities, <em>heart</em> healthy eating and <em>heart</em> healthy lifestyle choices. Our goal is to achieve improved <em>heart</em> health and increased education and awareness in young girls with a focus on <em>heart disease</em> prevention.  ', ' awareness, wellness, <em>heart</em> health, <em>heart disease</em> prevention, fitness, health, exercise, obesity, Education, Early childhood education, Health, Public health, Physical fitness, <em>Diseases</em> and conditions, Endocrine, nutritional']",New Orleans,LA,0,0,"Our mission is to empower, education and raise awareness of heart health, heart disease prevention, provide heart health education, and encourage healthy lifestyle choices for young girls ages 10-18 and their families.We promote physical activities, heart healthy eating and heart healthy lifestyle choices.Our goal is to achieve improved heart health and increased education and awareness in young girls with a focus on heart disease prevention.  In the past 4 years, Heart N Hands has educated over 2,500 young girls and their families and trained over 100 girls in Hands ONLY CPR (American Heart Association New Orleans).",https://facebook.com/heartnhands,https://twitter.com/myhearthands,https://youtube.com/https://youtu.be/CcEm2vfZw-U,https://instagram.com/my_heartnhandsnola,https://linkedin.com/company/heartnhands
GIFT OF LIFE INTERNATIONAL INC,,56-2322626,"['in Washington, DC and the Uganda <em>Heart</em> Institute to address the crisis of Rheumatic <em>Heart Disease</em> (RHD). As a result of the research completed, we have now established prevention, intervention and emotional support infrastructure for the tens of thousands of children at risk for and living with this <em>disease.</em> Rheumatic <em>Heart Disease</em> is an acquired <em>heart</em> valve <em>disease</em> that starts in early childhood with', ' Pediatric, children, <em>heart,</em> congenital <em>heart disease,</em> Cardiac, <em>Heart</em> Surgery, Catheterization, <em>Heart Disease,</em>  international, developing countries, Gift of Life, Gift of Life International, non-profit, sustainable, healing little <em>hearts</em> around the world, Health, Health care administration and financing, Patient social services, In-patient medical care, Hospital care, <em>Diseases</em> and conditions, Heart ']",Fresh Meadows,NY,1334809,2416396,"Our mission is to provide lifesaving cardiac treatment to children in need from developing countries regardless of their gender, creed, or national origin. Our goal is to develop sustainable pediatric cardiac programs by implementing screening, surgical, and training missions which are supported by autonomous Gift of Life programs, Rotary global grants, and generous donors from around the world.",https://facebook.com/pages/Gift-of-Life-International/228483773912741,https://twitter.com/https://twitter.com/goli_intl,https://youtube.com/user/giftoflifeint,https://instagram.com/goli_intl,https://linkedin.com/company/gift-of-life-international/?viewAsMember=true
Heart Disease Prevention Institute,,82-4686404,"['Created to research ways to help prevent <em>heart disease</em> and provide care for those at risk of <em>heart disease</em> and suffering from <em>heart</em> disease.Mission is to help prevent <em>heart disease</em> in those at risk and help provide medical care to those suffering the effects of <em>heart</em> disease.Currently we are providing fresh fruits and vegetables to those at risk of <em>heart disease</em> and medical supplies to hospitals and health', 'This unique situation will allow us to do a long term study of the <em>Heart Disease</em> prevention effects of a diet rich in Fruits and Vegetables. Scientific research concludes that the best diet for preventing <em>Heart Disease</em> is one that is low in fat and high in vegetables and fruits. Overall, most <em>Heart Disease</em> could be prevented. <em>Heart Disease</em> Prevention Institute provides Medical Supplies to Organizacion ']",Peoria,AZ,0,0,"Created to research ways to help prevent heart disease and provide care for those at risk of heart disease and suffering from heart disease.
Mission is to help prevent heart disease in those at risk and help provide medical care to those suffering the effects of heart disease.
Currently we are providing fresh fruits and vegetables to those at risk of heart disease and medical supplies to hospitals and health clinics providing care for those suffering the effects of heart disease",,,,,
Project Bubaloo Inc,Project Bubaloo,83-1296566,"['Spreading Congenital <em>Heart Disease</em> awareness and funding CHD research.', ' Research, CHD, <em>Heart,</em> community awareness, children, congenital <em>heart disease,</em> Health, <em>Diseases</em> and conditions, Age groups, Adults, Health, People with <em>diseases</em> and illnesses, Non-governmental organizations, Public charities']",Hubertus,WI,43844,102333,Spreading Congenital Heart Disease awareness and funding CHD research.,https://facebook.com/https://www.facebook.com/ProjectBubaloo,,,https://instagram.com/project_bubaloo,
Simon's Heart,Simon's Heart,20-2771448,"[' sudden cardiac arrest, sids, sads, cardiomyopathy, long qt, fainting, <em>heart disease,</em> pediatric, CPR, AED, Health, Public health, Medical specialties, Pediatrics, <em>Diseases</em> and conditions, <em>Heart</em> and circulatory system <em>diseases,</em> Age groups, Children and youth, Family relationships, Families, Non-governmental organizations', ""Simon's <em>Heart</em> prevents sudden cardiac arrest and death in children, teens and young adults. sudden""]",Conshohocken,PA,663582,963078,"Simon's Heart prevents sudden cardiac arrest and death in children, teens and young adults.",https://facebook.com/simonsheart.org/,https://twitter.com/@simonsheartorg,https://youtube.com/https://www.youtube.com/user/simonsfund,https://instagram.com/simonsheart,https://linkedin.com/company//company/simons-heart/
GYMJAM FOUNDATION,,06-1786827,"[' sports, gymnastics, children, <em>heart disease,</em> community, Sports and recreation, Sports, Sports training, Human services, Youth development, Youth services, Age groups, Children and youth, Family relationships, Families, Non-governmental organizations']",Santa Clarita,CA,24984,268856,"THE PRIMARY OBJECTIVES AND PURPOSES OF THE FOUNDATION SHALL BE TO FOSTER NATIONAL AND INTERNATIONAL AMATEUR SPORTS COMPETITION AS WELL AS CONDUCT NATIONAL OR INTERNATIONAL COMPETITION. AS SUCH, THE ACTIVITIES OF THE FOUNDATION INCLUDES FUNDRAISING TO ASSIST IN PAYING COSTS FOR MEET FEES, JUDGES FEES, COACHES FEES, TRAVEL EXPENSES, FOOD COSTS, INSURANCE, PROFESSIONAL DEVELOPMENT, PROFESSIONAL SERVICES; HOSTING GYMNASTICS MEETS; PROVIDING ATHLETES WITH SPONSORSHIP FOR NATIONAL AND INTERNATIONAL COMPETITION, AND OTHER EXPENDITURES AND ACTIVITIES EITHER DIRECTLY OR INDIRECTLY ASSOCIATED WITH THE PURPOSE OF THE FOUNDATION AS OUTLINED IN THE ARTICLES OF INCORPORATION.  IN ADDITION, THROUGH HOSTING GYMNASTICS MEETS, PROCEEDS CONTRIBUTE TO SUPPORTING CAMP DEL CORAZON, A CAMP FOR CHILDREN WITH CHDs",https://facebook.com/ChrisWallersHeartOfAChampion,,,https://instagram.com/heart_of_a_champion_meet,
CHINA CALIFORNIA HEART WATCH,China Cal,20-5111707,"['California <em>Heart</em> Watch (chinacal.org) has now partnered with the Mae Tao Clinic (maetaoclinic.org), Burma Children’s Medical Fund (burmachildren.org) and with dozens of refugee schools to find and treat children with <em>heart disease</em>.Due to the primitive conditions imposed on Burmese farmers and refugees, <em>heart disease</em> is much more prevalent among their children.   In 2020, China Cal will screen the <em>hearts</em> of ', 'Refugee Children <em>Heart Disease</em> Screening, Health, Out-patient medical care, Health care clinics, <em>Diseases</em> and conditions, Genetic conditions and birth defects, Age groups, Children and youth, Social and economic status, Economically disadvantaged people, Non-governmental organizations, Public charities Provides']",Denver,CO,0,0,"Our mission is to serve the rural poor in South East Asia through:
- Education and training of medical professionals
- Providing free healthcare to impoverished farmers
- Medical research",https://facebook.com/https://www.facebook.com/search/top/?q=china%20california%20heart%20watch,,,,
WomenHeart: The National Coalition for Women with Heart Disease,WomenHeart,52-2148006,"['Now in 88 local communities across the country, WomenHeart Support Networks led by trained volunteers-- all women living with <em>heart disease</em>-- meet monthly, providing <em>heart</em> health education programs, peer-to-peer encouragement, and guidance to help women living with <em>heart disease</em> maintain a high quality of life and become better partners with their physicians in their own healthcare.  Support Networks ', 'To improve the health and quality of life of women living with or at risk of <em>heart disease,</em> and to advocate for their benefit. Women']",Washington,DC,1649701,1900897,"To improve the health and quality of life of women living with or at risk of heart disease, and to advocate for their benefit.",https://facebook.com/WomenHeartNational,https://twitter.com/@WomenHeartOrg,https://youtube.com/WomenHeartTV,https://instagram.com/WomenHeart,https://linkedin.com/company/womenheart-the-national-coalition-for-women-with-heart-disease
Conquering CHD - Texas,CCHD-TX,85-0511030,"[' Congenital <em>Heart</em> Defect, Congenital <em>Heart Disease,</em> CHD,, Health, <em>Diseases</em> and conditions, <em>Heart</em> and circulatory system <em>diseases,</em> Family relationships, Non-governmental organizations, Public charities', 'improving understanding of congenital <em>heart disease</em> from the patient and family perspective-Research promotion and participation helping promising developments become reality.-Advocacy activities sharing our stories to improve federal research fundingPatient &amp; Family Access to Data and Decision-Making InformationLearning you or your child has congenital <em>heart disease</em> can be devastating. This new diagnosis']",Carrollton,TX,0,0,"We exist to conquer the most common birth defect. We engage, listen, learn, and act. We create visibility and empower all impacted by CHD. We accomplish this through awareness, knowledge, community, and research.",https://facebook.com/conqueringchdtx,https://twitter.com/conqueringchdtx,,https://instagram.com/conqueringchdtx,
Conquering CHD - Oklahoma,CCHD-OK,84-2688261,"[' Congenital <em>Heart</em> Defect, Congenital <em>Heart Disease,</em> CHD,, Health, <em>Diseases</em> and conditions, <em>Heart</em> and circulatory system <em>diseases,</em> Genetic conditions and birth defects, Family relationships, Families, Non-governmental organizations, Public charities', 'improving understanding of congenital <em>heart disease</em> from the patient and family perspective-Research promotion and participation helping promising developments become reality.-Advocacy activities sharing our stories to improve federal research fundingPatient &amp; Family Access to Data and Decision-Making InformationLearning you or your child has congenital <em>heart disease</em> can be devastating. This new diagnosis']",Oklahoma City,OK,0,0,"We exist to conquer the most common birth defect. We engage, listen, learn, and act. We create visibility and empower all impacted by CHD. We accomplish this through awareness, knowledge, community, and research.",https://facebook.com/conqueringchdok,https://twitter.com/conqueringchdok,,https://instagram.com/conqueringchdok,
Parent Heart Watch,PHW,11-3761392,"[' sudden cardiac arrest in youth, sudden cardiac death in youth, <em>heart</em> defects, cardiomyopathy, long qt, childrens <em>heart disease,</em> congenital <em>heart</em> defects', ' defects, Health, Out-patient medical care, Preventive care, <em>Diseases</em> and conditions, <em>Heart</em> and circulatory system <em>diseases,</em> Public safety, Age groups, Children and youth, Adults, Non-governmental organizations, Public charities']",Wilmington,DE,145793,118571,"Parent Heart Watch is the national voice solely dedicated to protecting youth from Sudden Cardiac Arrest (SCA) and preventable Sudden Cardiac Death (SCD). Parent Heart Watch leads and empowers others by sharing information, educating and advocating for change.",https://facebook.com/https://www.facebook.com/phwsca/,https://twitter.com/@PHWorg,https://youtube.com/https://www.youtube.com/channel/UCaNqYUiO0aqFy40bll1HBFw,https://instagram.com/phwsca,https://linkedin.com/company/https://www.linkedin.com/company/parent-heart-watch/
TEXAS BIOMEDICAL RESEARCH INSTITUTE,"Texas Biomedical Research Institute (Effective Feb. 1, 2011, the name of Southwest Foundation for Biomedical Research changed to the Texas Biomedical Research Institute to better reflect our organization and its mission. There is no change in control, tax exempt status, tax ID, or ownership.)",74-1109630,"["", virology, cancer, <em>heart disease,</em> diabetes, hepatitis, AIDS/HIV, infectious <em>disease,</em> cardiovascular <em>disease,</em> emerging viruses, Malaria, neurological <em>diseases,</em> Parkinson's <em>disease,</em> arthritis, Health, Public health, Communicable <em>disease</em> control, Medical specialties, Biomedicine, <em>Diseases</em> and conditions, Respiratory system <em>diseases,</em> Age groups, Adults, Health, People with <em>diseases</em> and illnesses, Non-governmental"", ' human <em>disease</em> – interactions between microbes and humans that cause <em>disease,</em> creation of new diagnostics, therapies and vaccines and further understanding of the health of human populations. By bringing together the best minds and providing exceptional resources, Texas Biomed advances the study of how people are impacted by infection with the aim of diagnosing, preventing and curing <em>disease.</em> By the']",San Antonio,TX,234572359,103389937,Texas Biomedical Research Institute (formerly Southwest Foundation for Biomedical Research) is dedicated to improving the health of our global community through innovative biomedical research.,https://facebook.com/txbiomed,https://twitter.com/@txbiomed,https://youtube.com/texasbiomedicalresearchinstitute,,https://linkedin.com/company/@texasbiomedicalresearchinstitute
Children's Cardiomyopathy Foundation,CCF,75-2986661,"[' cardiomyopathy, pediatrics, children, genetic disorders, medical research, <em>heart disease,</em> congenital <em>heart</em> defect, Health, Medical specialties, Pediatrics, <em>Diseases</em> and conditions, <em>Heart</em> and circulatory system <em>diseases,</em> Age groups, Children and youth, Family relationships, Families, Work status and occupations, Academics, Non-governmental organizations', ""The Children's Cardiomyopathy Foundation (CCF) is a national non-profit focused on pediatric cardiomyopathy, a chronic and potentially life-threatening <em>heart disease</em> that can affect children of any age regardless of gender, ethnicity, or socio-economic background. CCF's mission is to accelerate the search for causes and cures for pediatric cardiomyopathy through increased research, education, awareness""]",Tenafly,NJ,2508496,1107136,"The Children's Cardiomyopathy Foundation (CCF) is a national non-profit focused on pediatric cardiomyopathy, a chronic and potentially life-threatening heart disease that can affect children of any age regardless of gender, ethnicity, or socio-economic background. CCF's mission is to accelerate the search for causes and cures for pediatric cardiomyopathy through increased research, education, awareness and advocacy, and to support families whose children are affected by the disease.

To learn more about our programs and services, as well as our achievements please visit CCF at www.childrenscardiomyopathy.org",https://facebook.com/CCFheartkids,https://twitter.com/CCFheartkids,https://youtube.com/CCFHeartKids,https://instagram.com/CCFHeartKids,https://linkedin.com/company/Children's Cardiomyopathy Foundation
Conquering CHD - Louisiana,CCHD - LA,86-1326907,"[' Congenital <em>Heart</em> Defect, Congenital <em>Heart Disease,</em> CHD,, Health, <em>Diseases</em> and conditions, Genetic conditions and birth defects, Family relationships, Families, Non-governmental organizations, Public charities', 'insight from someone who has walked a similar path. Social events providing a safe environment to celebrate life and simple joys together. Physician education improving understanding of congenital <em>heart disease</em> from the patient and family perspective. Research promotion and participation helping promising developments become reality. Advocacy activities sharing our stories to improve federal research funding']",Metairie,LA,0,0,"We exist to conquer the most common birth defect. We engage, listen, learn, and act. We create visibility and empower all impacted by CHD. We accomplish this through awareness, knowledge, community, and research.",https://facebook.com/conqueringchdla,https://twitter.com/conqueringchdla,,https://instagram.com/conqueringchdla,
Conquering CHD - Illinois,CCHD - IL,81-5401105,"['improving understanding of congenital <em>heart disease</em> from the patient and family perspective-Research promotion and participation helping promising developments become reality.-Advocacy activities sharing our stories to improve federal research fundingPatient &amp; Family Access to Data and Decision-Making InformationLearning you or your child has congenital <em>heart disease</em> can be devastating. This new diagnosis', ' Congenital <em>Heart</em> Defect, Congenital <em>Heart Disease,</em> CHD,, Health, <em>Diseases</em> and conditions, Genetic conditions and birth defects, Family relationships, Families, Non-governmental organizations, Public charities We']",Elgin,IL,0,0,"We exist to conquer the most common birth defect. We engage, listen, learn, and act. We create visibility and empower all impacted by CHD. We accomplish this through awareness, knowledge, community, and research.",https://facebook.com/conqueringchdil,https://twitter.com/conqueringchdil,,https://instagram.com/conqueringchdil,
Conquering CHD - Wisconsin,CCHD-WI,82-1625343,"['improving understanding of congenital <em>heart disease</em> from the patient and family perspective-Research promotion and participation helping promising developments become reality.-Advocacy activities sharing our stories to improve federal research fundingPatient &amp; Family Access to Data and Decision-Making InformationLearning you or your child has congenital <em>heart disease</em> can be devastating. This new diagnosis', ' Congenital <em>Heart</em> Defect, Congenital <em>Heart Disease,</em> CHD,, Health, <em>Diseases</em> and conditions, Genetic conditions and birth defects, Family relationships, Families, Non-governmental organizations, Public charities We']",Fitchburg,WI,0,0,"We exist to conquer the most common birth defect. We engage, listen, learn, and act. We create visibility and empower all impacted by CHD. We accomplish this through awareness, knowledge, community, and research.",https://facebook.com/ConqueringCHDWi,https://twitter.com/ConqueringCHDWi,,https://instagram.com/ConqueringCHDWi,
Conquering CHD - Colorado,CCHD - CO,81-5409979,"['improving understanding of congenital <em>heart disease</em> from the patient and family perspective -Research promotion and participation helping promising developments become reality. -Advocacy activities sharing our stories to improve federal research fundingPatient &amp; Family Access to Data and Decision-Making InformationLearning you or your child has congenital <em>heart disease</em> can be devastating. This new diagnosis', ' Congenital <em>Heart</em> Defect, Congenital <em>Heart Disease,</em> CHD,, Health, <em>Diseases</em> and conditions, Genetic conditions and birth defects, Family relationships, Families, Non-governmental organizations, Public charities We']",Denver,CO,0,0,"We exist to conquer the most common birth defect. We engage, listen, learn, and act. We create visibility and empower all impacted by CHD. We accomplish this through awareness, knowledge, community, and research.",https://facebook.com/ConqueringCHDCo,https://twitter.com/ConqueringCHDCo,,https://instagram.com/ConqueringCHDCo,
Conquering CHD - Tennessee,CCHD-TN,81-4829701,"['improving understanding of congenital <em>heart disease</em> from the patient and family perspective-Research promotion and participation helping promising developments become reality.-Advocacy activities sharing our stories to improve federal research fundingPatient &amp; Family Access to Data and Decision-Making InformationLearning you or your child has congenital <em>heart disease</em> can be devastating. This new diagnosis', ' Congenital <em>Heart</em> Defect, Congenital <em>Heart Disease,</em> CHD,, Health, <em>Diseases</em> and conditions, Genetic conditions and birth defects, Family relationships, Families, Non-governmental organizations, Public charities We']",Mt Juliet,TN,0,0,"We exist to conquer the most common birth defect. We engage, listen, learn, and act. We create visibility and empower all impacted by CHD. We accomplish this through awareness, knowledge, community, and research.",https://facebook.com/ConqueringCHDTn,https://twitter.com/ConqueringCHDTn,,https://instagram.com/ConqueringCHDTn,
Conquering CHD - Michigan,CCHD - MI,81-4842438,"['improving understanding of congenital <em>heart disease</em> from the patient and family perspective -Research promotion and participation helping promising developments become reality. -Advocacy activities sharing our stories to improve federal research fundingPatient &amp; Family Access to Data and Decision-Making InformationLearning you or your child has congenital <em>heart disease</em> can be devastating. This new diagnosis', ' Congenital <em>Heart</em> Defect, Congenital <em>Heart Disease,</em> CHD,, Health, <em>Diseases</em> and conditions, Genetic conditions and birth defects, Family relationships, Families, Non-governmental organizations, Public charities We']",Alto,MI,0,0,"We exist to conquer the most common birth defect. We engage, listen, learn, and act. We create visibility and empower all impacted by CHD. We accomplish this through awareness, knowledge, community, and research.",https://facebook.com/ConqueringCHDMI,https://twitter.com/ConqueringCHDMI,,https://instagram.com/ConqueringCHDMI,
